<?xml version="1.0" encoding="UTF-8"?>
<!ELEMENT movies (movie+)>
<!ELEMENT movies (code,title,release-date?,theatre-name+,city*)>
<!ELEMENT code (#PCDATA)>
<!ELEMENT title (#PCDATA)>
<!ELEMENT release-date (day,month,year)>
<!ELEMENT day (#PCDATA)>
<!ELEMENT month (#PCDATA)>
<!ELEMENT year (#PCDATA)>
<!ELEMENT theatre-name (#PCDATA)>
<!ELEMENT city (#PCDATA)>